{
  "schema_version": 1,
  "receipt_id": "rcpt-checkout-e2e-web-001",
  "requirement_ids": [
    "REQ-CHECKOUT-E2E"
  ],
  "repository": "web",
  "commit_sha": "0fc24560cd3d6512f0508518f313de44bf0135e4",
  "runner_id": "synthetic-runner-1",
  "environment": "staging",
  "test_level": "e2e",
  "execution_kind": "live",
  "result": "pass",
  "tests": {
    "total": 12,
    "passed": 12,
    "failed": 0,
    "skipped": 0
  },
  "artifact": {
    "path": "artifacts/rcpt-checkout-e2e-web-001.xml",
    "sha256": "4bd18377ed704d1a998040d07bca4d0ce942e248950923e818ba45bae3a58686"
  },
  "finished_at": "2026-09-29T10:00:00Z",
  "command": "synthetic test command (recorded as text, never executed)"
}
